asset_id,db_hostname,db_type,db_version,db_instance_name,ip_address,scan_date,benchmark_standard,control_id,control_description,compliance_status,current_value,expected_value,Severity,remediation,exception_status
APP-003,cbs-db-01,oracle,19c,CBS_PROD,10.20.20.10,2025-02-12,CIS Oracle 19c,2.1.1,Ensure DBA_USERS_WITH_DEFPWD view shows no users with default passwords,fail,11 users with default passwords,0 users with default passwords,Critical,"Immediately change default passwords for: SYS, SYSTEM, DBSNMP, APEX_PUBLIC_USER",no_exception
APP-003,cbs-db-01,oracle,19c,CBS_PROD,10.20.20.10,2025-02-12,CIS Oracle 19c,3.1,Ensure AUDIT_TRAIL is set to DB_EXTENDED,fail,AUDIT_TRAIL = NONE,DB_EXTENDED,High,Set AUDIT_TRAIL = DB_EXTENDED in Oracle initialization parameters and restart instance,no_exception
APP-003,cbs-db-01,oracle,19c,CBS_PROD,10.20.20.10,2025-02-12,CIS Oracle 19c,4.1.1,Ensure CREATE SESSION privilege is revoked from PUBLIC,fail,PUBLIC has CREATE SESSION,PUBLIC should not have CREATE SESSION,High,REVOKE CREATE SESSION FROM PUBLIC;,no_exception
APP-003,cbs-db-01,oracle,19c,CBS_PROD,10.20.20.10,2025-02-12,CIS Oracle 19c,5.2,Ensure REMOTE_OS_AUTHENT is set to FALSE,pass,FALSE,FALSE,High,,no_exception
APP-004,pay-db-01,mssql,2019,PAYMENTDB,10.20.20.20,2025-02-14,CIS MSSQL 2019,2.1,Ensure Latest SQL Server Service Packs and Hotfixes are installed,fail,SQL Server 2019 RTM CU18,SQL Server 2019 RTM CU25+,High,Apply latest CU to SQL Server 2019 ASAP,no_exception
